<?xml version="1.0" encoding="utf-8"?>

<object-mechanics  xmlns:xsi="http://www.w3.org/2001/XMLSchema-instance" xsi:noNamespaceSchemaLocation="https://raw.githubusercontent.com/cracrayol/kaichronicles/master/www/data/objects.xsd">

    <weapons>
        <!-- WEAPONS ON KAI / MAGNAKAI SERIES BOOKS -->
        <weapon id="axe">
            <name>Axe</name>
            <image book="1|9" name="axe.png" />
        </weapon>

        <weapon id="dagger">
            <name>Dagger</name>
            <image book="1|9" name="dagger.png" />
        </weapon>

        <weapon id="sword">
            <name>Sword</name>
            <image book="1|9" name="sword.png" />
        </weapon>

        <weapon id="spear">
            <name>Spear</name>
            <image book="1|9" name="spear.png" />
        </weapon>

        <weapon id="mace">
            <name>Mace</name>
            <image book="1|9" name="mace.png" />
        </weapon>

        <weapon id="shortsword">
            <name>Short Sword</name>
            <image book="1|9" name="ssword.png" />
        </weapon>

        <weapon id="quarterstaff" grdWpnmstryBonus="false">
            <name>Quarterstaff</name>
            <image book="1|9" name="qstaff.png" />
        </weapon>

        <weapon id="warhammer">
            <name>Warhammer</name>
            <image book="1|9" name="warhammr.png" />
        </weapon>

        <weapon id="broadsword">
            <name>Broad Sword</name>
            <image book="1|9" name="bsword.png" />
        </weapon>

        <!-- BOOK 3 -->

        <weapon id="bonesword" weaponType="sword">
            <name>Bone Sword</name>
            <image book="3" name="sword.png" />
        </weapon>

        <weapon id="bonedagger" weaponType="dagger">
            <name>Bone Dagger</name>
            <image book="3" name="small17.png" />
        </weapon>

        <!-- BOOK 4 -->

        <weapon id="captaindvalsword" weaponType="sword">
            <name>Captain D’Val’s Sword</name>
            <description>
                It has an inscription on the blade: ‘Captain Remir D’Val—King’s Guard Regiment’
            </description>
            <image book="1" name="sword.png" />
        </weapon>

        <!-- BOOK 5 -->

        <weapon id="jakan" weaponType="bow" grdWpnmstryBonus="false">
            <name>Jakan</name>
            <description>
                A hunting bow used by the coastal fishermen of Vassagonia
            </description>
            <image book="6" name="bow.png" />
        </weapon>

        <!-- BOOK 6 -->

        <weapon id="bow" grdWpnmstryBonus="false">
            <name>Bow</name>
            <image book="6|9" name="bow.png" />
        </weapon>

        <weapon id="broninwarhammer" weaponType="warhammer">
            <name>Bronin Warhammer</name>
            <description>
                Wrought of a metal called bronin. When you use it in combat it will add 1 point to your COMBAT SKILL
            </description>
            <image book="1" name="warhammr.png" />
            <effect class="combatSkill" increment="1" />
        </weapon>

        <!-- BOOK 18 -->
        <weapon id="luthadagger" weaponType="dagger">
            <name>Prince Lutha's Dagger</name>
            <image book="1|9" name="dagger.png" />
        </weapon>

        <!-- BOOK 25 -->
        <weapon id="halberd">
            <name>Halberd (Spear)</name>
            <image book="1|9" name="spear.png" />
        </weapon>

    </weapons>

    <specials>
        <!-- SPECIAL OBJECTS -->

        <!-- BOOK 1 -->

        <special id="helmet" incompatibleWith="silverhelm">
            <name>Helmet</name>
            <description>This adds 2 ENDURANCE points to your total.</description>
            <image book="1" name="helmet.png" />
            <effect class="endurance" increment="2" />
        </special>

        <special id="chainmail" incompatibleWith="chainmail|broninvest">
            <name>Chainmail Waistcoat</name>
            <description>This adds 4 ENDURANCE points to your total.</description>
            <image book="1" name="mail.png" />
            <effect class="endurance" increment="4" />
        </special>

        <special id="map" itemCount="0">
            <name>Map</name>
        </special>

        <special id="tombguardiangems">
            <name>20 Tomb Guardian Gems</name>
        </special>

        <special id="crystalstar">
            <name>Crystal Star Pendant</name>
            <description>
                It is the symbol of the Brotherhood of the Crystal Star 
                (the Magicians’ Guild of Toran)
            </description>
        </special>

        <!-- BOOK 2 -->

        <special id="shield" incompatibleWith="shield">
            <name>Shield</name>
            <description>This adds 2 points to your COMBAT SKILL</description>
            <image book="2" name="shield.png" />
            <effect class="combatSkill" increment="2" />
        </special>

        <special id="portbaxticket">
            <name>Ticket to Port Bax</name>
        </special>

        <special id="sommerswerd" weaponType="sword|broadsword|shortsword" grdWpnmstryBonus="false">
            <name>Sommerswerd</name>
            <description>
                When used in combat, the Sommerswerd will add 8 points to your COMBAT SKILL 
                (+ Weaponskill with swords).
            </description>
            <extraDescription>
                It has the ability to absorb any magic that is used against its bearer, and it doubles 
                the total of all ENDURANCE points lost by undead enemies in combat
            </extraDescription>
            <image book="2" name="ill5.png" />
            <effect class="combatSkill" increment="8" />
        </special>

        <special id="magicspear" weaponType="spear" grdWpnmstryBonus="false">
            <name>Magic Spear</name>
            <image book="1" name="spear.png" />
        </special>

        <special id="sealofhammerdal">
            <name>Seal of Hammerdal</name>
            <description>
                A golden ring bearing the royal arms of Durenor
            </description>
            <image book="2" name="seal.png" />
        </special>

        <special id="portbaxpapers">
            <name>Papers</name>
            <description>
                An envelope containing a sheaf of official-looking papers
            </description>
        </special>

        <special id="whitepass">
            <name>White Pass</name>
        </special>

        <special id="redpass">
            <name>Red Pass</name>
        </special>

        <!-- BOOK 3 -->

        <special id="leatherwaistcoat" incompatibleWith="leatherwaistcoat">
            <name>Padded Leather Waistcoat</name>
            <description>
                This adds 2 ENDURANCE points to your total
            </description>
            <image book="3" name="plw.png" />
            <effect class="endurance" increment="2" />
        </special>

        <special id="baknaroil" droppable="false">
            <!-- On books this is not really an object, just an "annotation" on 
                the action chart... -->
            <name>Baknar Oil on your skin</name>
            <description>
                Baknar oil gives excellent insulation from the bitter cold of Kalte
            </description>
        </special>

        <special id="diamond">
            <name>Diamond</name>
        </special>

        <special id="trianglebluestone">
            <name>Triangle of Blue Stone</name>
            <description>
                It is a small triangle of blue stone on a neck chain
            </description>
            <image book="3" name="small25.png" />
        </special>

        <special id="bracelet" droppable="false">
            <name>Bracelet</name>
            <description>
                A plain bracelet, without mark or inscription, and appear to be made of solid gold
            </description>
        </special>

        <special id="silverkeybook3">
            <name>Silver Key (Book 3)</name>
            <image book="1" name="small15.png" />
        </special>

        <special id="glowingcrystal">
            <name>Glowing Crystal</name>
            <image book="3" name="ill19.png" />
        </special>

        <special id="stoneeffigy">
            <name>Stone Effigy</name>
            <description>
                A small statuette of a strange tentacled creature
            </description>
            <image book="3" name="small10.png" />
        </special>

        <special id="bluestonedisc">
            <name>Blue Stone Disc</name>
        </special>

        <special id="firesphere">
            <name>Firesphere</name>
            <image book="3" name="small7.png" />
        </special>

        <special id="silverhelm" incompatibleWith="helmet">
            <name>Silver Helm</name>
            <description>
                If worn during combat, it will increase your COMBAT SKILL by 2 points
            </description>
            <image book="3" name="small26.png" />
            <effect class="combatSkill" increment="2" />
        </special>

        <special id="kalkothbonesword" weaponType="sword">
            <name>Kalkoth Rib Blade</name>
            <description>
                Adds 1 to your COMBAT SKILL when used in Kalte.
            </description>
            <image book="3" name="sword.png" />
        </special>

        <!-- BOOK 4 -->

        <special id="onyxmedallion">
            <name>Onyx Medallion</name>
            <image book="4" name="small3.png" />
        </special>

        <special id="scrollpoetry">
            <name>Scroll</name>
            <description>
                Upon the scroll is written the following verse:
            </description>
            <extraDescription>
                When the full moon shines o’er the temple deep, /
                A sacrifice will stir from sleep /
                The legions of a long forgotten lord. /